[
  {
    "id": "4aabf93a-52aa-454d-bf7e-d3eb8d28f64b",
    "spec_id": "SPEC-0033",
    "title": "TST-0183 CLI-Verhalten Contract Test implementieren",
    "description": "Vollständige Test-Implementierung in tests/contract/test_tst_0183.py für CON-0157: Happy Path (2 Contracts → ≥4 HOL-Dateien + tabellarischer Output), Spec-ohne-Contracts-Abbruch, Status-draft-Abbruch, Idempotenz (bestehende HOL-Dateien überspringen mit Hinweis). Alle Szenarien aus dem Gherkin-Block der Spec.",
    "type": "test",
    "complexity": "medium",
    "context_size": "M",
    "estimated_tokens": 4500,
    "status": "pending",
    "retry_count": 0,
    "llm_id": null,
    "container_id": null,
    "commit_hash": null,
    "dependencies": [],
    "error_context": [],
    "con_ids": [],
    "parallel_group": "group-tests",
    "test_ids": [],
    "actual_tokens": null,
    "run_id": null,
    "test_file": null,
    "test_command": null,
    "test_framework": null
  },
  {
    "id": "53d0c13a-fac6-4b6d-8faf-aec3a708aed7",
    "spec_id": "SPEC-0033",
    "title": "TST-0184 HOL-Datei-Struktur Contract Test implementieren",
    "description": "Vollständige Test-Implementierung in tests/contract/test_tst_0184.py für CON-0158: Prüft dass jede erzeugte HOL-Datei die Pflichtfelder id, spec, status='ready', title sowie die Sektionen '## Input', '## Expected', '## Evaluation Hint' enthält. Idempotenz-Prüfung: zweiter Lauf erzeugt keine neuen Dateien.",
    "type": "test",
    "complexity": "low",
    "context_size": "S",
    "estimated_tokens": 2500,
    "status": "pending",
    "retry_count": 0,
    "llm_id": null,
    "container_id": null,
    "commit_hash": null,
    "dependencies": [],
    "error_context": [],
    "con_ids": [],
    "parallel_group": "group-tests",
    "test_ids": [],
    "actual_tokens": null,
    "run_id": null,
    "test_file": null,
    "test_command": null,
    "test_framework": null
  },
  {
    "id": "353d1190-d0f6-4096-9e58-52ca5ecab72b",
    "spec_id": "SPEC-0033",
    "title": "Spec Validation Logic",
    "description": "Reine Funktion load_and_validate_spec(spec_id: str) -> dict: Lädt Spec-YAML aus .sdd/specs/, validiert status ('approved' oder 'in-progress', sonst ValueError mit FR-06-Meldung), prüft contracts-Liste nicht leer (sonst ValueError mit FR-05-Meldung). Wirft FileNotFoundError bei fehlender Spec-ID.",
    "type": "code",
    "complexity": "low",
    "context_size": "S",
    "estimated_tokens": 2500,
    "status": "pending",
    "retry_count": 0,
    "llm_id": null,
    "container_id": null,
    "commit_hash": null,
    "dependencies": [],
    "error_context": [],
    "con_ids": [],
    "parallel_group": "group-core",
    "test_ids": [],
    "actual_tokens": null,
    "run_id": null,
    "test_file": "tests/unit/test_spec_validation_logic.py",
    "test_command": "pytest tests/unit/test_spec_validation_logic.py -x --tb=short",
    "test_framework": "pytest"
  },
  {
    "id": "4ad9e5ce-9c62-4c53-8210-e6452a1fe5e4",
    "spec_id": "SPEC-0033",
    "title": "Contract File Resolver",
    "description": "Funktion resolve_contract_files(contract_ids: list[str]) -> list[dict]: Sucht für jede Contract-ID die passende Datei unter .sdd/contracts/ (glob auf CON-XXXX-*.md). Gibt Liste von {id, path, content} zurück. Loggt Warnung und überspringt bei nicht gefundener Datei (Edge Case Abschnitt 7).",
    "type": "code",
    "complexity": "low",
    "context_size": "S",
    "estimated_tokens": 2000,
    "status": "pending",
    "retry_count": 0,
    "llm_id": null,
    "container_id": null,
    "commit_hash": null,
    "dependencies": [],
    "error_context": [],
    "con_ids": [],
    "parallel_group": "group-core",
    "test_ids": [],
    "actual_tokens": null,
    "run_id": null,
    "test_file": "tests/unit/test_contract_file_resolver.py",
    "test_command": "pytest tests/unit/test_contract_file_resolver.py -x --tb=short",
    "test_framework": "pytest"
  },
  {
    "id": "0bbb4a14-fe2d-4e5d-8129-f905169f24f7",
    "spec_id": "SPEC-0033",
    "title": "HOL Idempotenz-Checker",
    "description": "Funktion get_existing_hol_ids_for_spec(spec_id: str) -> set[str]: Scannt .sdd/holdouts/ nach HOL-*.md-Dateien, liest YAML-Frontmatter, sammelt alle HOL-IDs mit passendem 'spec'-Feld. Gibt Set zurück. Ermöglicht Skip-Logik für bereits vorhandene Holdouts (FR-04).",
    "type": "code",
    "complexity": "low",
    "context_size": "S",
    "estimated_tokens": 2000,
    "status": "pending",
    "retry_count": 0,
    "llm_id": null,
    "container_id": null,
    "commit_hash": null,
    "dependencies": [],
    "error_context": [],
    "con_ids": [],
    "parallel_group": "group-core",
    "test_ids": [],
    "actual_tokens": null,
    "run_id": null,
    "test_file": "tests/unit/test_hol_idempotenz_checker.py",
    "test_command": "pytest tests/unit/test_hol_idempotenz_checker.py -x --tb=short",
    "test_framework": "pytest"
  },
  {
    "id": "2cf52931-70a5-4ddd-a167-246393aa2ff0",
    "spec_id": "SPEC-0033",
    "title": "HOL-Datei Writer",
    "description": "Funktion write_hol_file(hol_id: str, spec_id: str, contract_id: str, scenario: dict) -> Path: Schreibt .sdd/holdouts/HOL-XXXX-<slug>.md mit YAML-Frontmatter (id, spec, contract, status='ready', title) und Markdown-Sektionen '## Input', '## Expected', '## Evaluation Hint' aus scenario-Dict. Gibt Pfad zurück (FR-03, CON-0158).",
    "type": "code",
    "complexity": "low",
    "context_size": "S",
    "estimated_tokens": 2500,
    "status": "pending",
    "retry_count": 0,
    "llm_id": null,
    "container_id": null,
    "commit_hash": null,
    "dependencies": [],
    "error_context": [],
    "con_ids": [],
    "parallel_group": "group-core",
    "test_ids": [],
    "actual_tokens": null,
    "run_id": null,
    "test_file": "tests/unit/test_hol_datei_writer.py",
    "test_command": "pytest tests/unit/test_hol_datei_writer.py -x --tb=short",
    "test_framework": "pytest"
  },
  {
    "id": "86fcacee-ee81-414c-badb-b905a384b943",
    "spec_id": "SPEC-0033",
    "title": "LLM Scenario Generator",
    "description": "Funktion generate_holdout_scenarios(contract_content: str, contract_id: str, num_scenarios: int = 3) -> list[dict]: Liest LLM-Provider aus .sdd/config.yaml, baut Prompt mit Contract-Inhalt, ruft LLM auf, parst JSON-Response in Liste von {title, input, expected, evaluation_hint}. Enthält Happy Path + mind. 1 Fehlerfall. Retry 1x bei LLM-Fehler, danach RuntimeError (FR-02, NFR LLM-Provider, Edge Case).",
    "type": "code",
    "complexity": "high",
    "context_size": "L",
    "estimated_tokens": 7000,
    "status": "pending",
    "retry_count": 0,
    "llm_id": null,
    "container_id": null,
    "commit_hash": null,
    "dependencies": [],
    "error_context": [],
    "con_ids": [],
    "parallel_group": "group-core",
    "test_ids": [],
    "actual_tokens": null,
    "run_id": null,
    "test_file": "tests/unit/test_llm_scenario_generator.py",
    "test_command": "pytest tests/unit/test_llm_scenario_generator.py -x --tb=short",
    "test_framework": "pytest"
  },
  {
    "id": "10e08eee-9f1d-4151-964f-6e59f91f3f08",
    "spec_id": "SPEC-0033",
    "title": "generate-holdouts CLI Command",
    "description": "Click-Befehl 'sdd generate-holdouts SPEC-ID': Orchestriert Spec-Validierung (FR-05, FR-06), Contract-Auflösung mit Warnung bei fehlender Datei, HOL-Idempotenz-Check (FR-04, Skip mit Hinweis), LLM-Szenario-Generierung, HOL-Datei-Schreiben, tabellarische Ausgabe aller HOL-IDs mit Contract-Zuordnung (FR-07). Registriert Command in der CLI-Gruppe. Exit-Code 1 bei Abbruch.",
    "type": "code",
    "complexity": "high",
    "context_size": "L",
    "estimated_tokens": 5500,
    "status": "pending",
    "retry_count": 0,
    "llm_id": null,
    "container_id": null,
    "commit_hash": null,
    "dependencies": [
      "Spec Validation Logic",
      "Contract File Resolver",
      "HOL Idempotenz-Checker",
      "HOL-Datei Writer",
      "LLM Scenario Generator"
    ],
    "error_context": [],
    "con_ids": [],
    "parallel_group": null,
    "test_ids": [],
    "actual_tokens": null,
    "run_id": null,
    "test_file": "tests/contract/test_tst_0183.py",
    "test_command": "pytest tests/contract/test_tst_0183.py -x --tb=short",
    "test_framework": "pytest"
  }
]