[
  {
    "id": "5464d92a-7ca9-4f35-a982-b58219b7aad0",
    "spec_id": "SPEC-0050",
    "title": "Factory: Builtin-Default completion auf claude-cli umstellen",
    "description": "In tool/sdd_cli/llm/factory.py den Eintrag _COMPLETION_BUILTIN['completion'] von provider 'anthropic' auf 'claude-cli' aendern. get_completion_provider(config, 'completion') liefert ohne jegliche llm-Konfiguration einen claude-cli-Provider. Auflösungs-Hierarchie (Komponenten-Override → Default-Block → Builtin) bleibt unangetastet. Adressiert FR-01.",
    "type": "code",
    "complexity": "low",
    "context_size": "M",
    "estimated_tokens": 2500,
    "status": "pending",
    "retry_count": 0,
    "llm_id": null,
    "container_id": null,
    "commit_hash": null,
    "dependencies": [],
    "error_context": [],
    "con_ids": [],
    "parallel_group": null,
    "test_ids": [],
    "actual_tokens": null,
    "run_id": null,
    "test_file": "tests/unit/test_factory_completion_default.py",
    "test_command": "pytest tests/unit/test_factory_completion_default.py -x --tb=short",
    "test_framework": "pytest"
  },
  {
    "id": "71864d54-6471-4c59-bef5-179a595953ac",
    "spec_id": "SPEC-0050",
    "title": "Factory: Fail-Loud bei nicht nutzbarem Provider ohne stillen Fallback",
    "description": "In tool/sdd_cli/llm/factory.py den Fehlerpfad schaerfen: Ist der aufgeloeste Provider nicht nutzbar (claude CLI fehlt/nicht angemeldet; anthropic ohne Key), wird ein RuntimeError mit eindeutiger Ursache geworfen. Kein automatischer Wechsel auf einen anderen Provider, kein leeres Provider-Objekt. Adressiert FR-02.",
    "type": "code",
    "complexity": "medium",
    "context_size": "M",
    "estimated_tokens": 3500,
    "status": "pending",
    "retry_count": 0,
    "llm_id": null,
    "container_id": null,
    "commit_hash": null,
    "dependencies": [
      "Factory: Builtin-Default completion auf claude-cli umstellen"
    ],
    "error_context": [],
    "con_ids": [],
    "parallel_group": null,
    "test_ids": [],
    "actual_tokens": null,
    "run_id": null,
    "test_file": "tests/unit/test_factory_fail_loud.py",
    "test_command": "pytest tests/unit/test_factory_fail_loud.py -x --tb=short",
    "test_framework": "pytest"
  },
  {
    "id": "e1ac9b4b-1df1-4e1e-a5eb-0b310885d956",
    "spec_id": "SPEC-0050",
    "title": "Factory: anthropic-Provider als Config-Opt-in unveraendert nutzbar halten",
    "description": "Sicherstellen, dass bei expliziter Konfiguration llm.completion.provider: anthropic plus gueltigem api_key weiterhin der anthropic-Provider erzeugt wird (unveraendertes Verhalten). Regressionsabsicherung gegen die Default-Aenderung. Adressiert FR-05.",
    "type": "code",
    "complexity": "low",
    "context_size": "M",
    "estimated_tokens": 2500,
    "status": "pending",
    "retry_count": 0,
    "llm_id": null,
    "container_id": null,
    "commit_hash": null,
    "dependencies": [
      "Factory: Builtin-Default completion auf claude-cli umstellen"
    ],
    "error_context": [],
    "con_ids": [],
    "parallel_group": null,
    "test_ids": [],
    "actual_tokens": null,
    "run_id": null,
    "test_file": "tests/unit/test_factory_anthropic_optin.py",
    "test_command": "pytest tests/unit/test_factory_anthropic_optin.py -x --tb=short",
    "test_framework": "pytest"
  },
  {
    "id": "48133034-ab52-4a09-a603-6a43fc9253a4",
    "spec_id": "SPEC-0050",
    "title": "pattern.py: LLM-Fehler sichtbar melden statt leeres Ergebnis",
    "description": "In tool/sdd_cli/pattern.py den LLM-Fehlerpfad so aendern, dass ein Provider-/LLM-Fehler nicht still abgefangen und als 'keine Vorschläge' ausgegeben wird, sondern sichtbar als '[WARN] Pattern-Vorschläge übersprungen: <Grund>' gemeldet wird. Unterscheidet 'kein LLM' von 'keine Vorschläge'. Adressiert FR-03.",
    "type": "code",
    "complexity": "medium",
    "context_size": "M",
    "estimated_tokens": 3000,
    "status": "pending",
    "retry_count": 0,
    "llm_id": null,
    "container_id": null,
    "commit_hash": null,
    "dependencies": [
      "Factory: Fail-Loud bei nicht nutzbarem Provider ohne stillen Fallback"
    ],
    "error_context": [],
    "con_ids": [],
    "parallel_group": "fail-loud-callers",
    "test_ids": [],
    "actual_tokens": null,
    "run_id": null,
    "test_file": "tests/unit/test_pattern_llm_error_visible.py",
    "test_command": "pytest tests/unit/test_pattern_llm_error_visible.py -x --tb=short",
    "test_framework": "pytest"
  },
  {
    "id": "125c1ae8-89c6-4898-8fdc-8bae4eb199e1",
    "spec_id": "SPEC-0050",
    "title": "solid.py: LLM-Fehler sichtbar melden statt compliant",
    "description": "In tool/sdd_cli/solid.py den LLM-Fehlerpfad analog zu pattern.py behandeln: ein Provider-/LLM-Fehler wird sichtbar als '[WARN] … übersprungen: <Grund>' gemeldet und nicht als 'compliant' dargestellt. Verschleiert keine echte Pruefluecke. Adressiert FR-04.",
    "type": "code",
    "complexity": "medium",
    "context_size": "M",
    "estimated_tokens": 3000,
    "status": "pending",
    "retry_count": 0,
    "llm_id": null,
    "container_id": null,
    "commit_hash": null,
    "dependencies": [
      "Factory: Fail-Loud bei nicht nutzbarem Provider ohne stillen Fallback"
    ],
    "error_context": [],
    "con_ids": [],
    "parallel_group": "fail-loud-callers",
    "test_ids": [],
    "actual_tokens": null,
    "run_id": null,
    "test_file": "tests/unit/test_solid_llm_error_visible.py",
    "test_command": "pytest tests/unit/test_solid_llm_error_visible.py -x --tb=short",
    "test_framework": "pytest"
  },
  {
    "id": "fa19cebf-0bd4-4e3d-886d-fa8bd3f73574",
    "spec_id": "SPEC-0050",
    "title": "Regressionstest: evaluator-Komponente bleibt claude-cli/keyfrei",
    "description": "Test, der absichert, dass die Komponente 'evaluator' (Holdout-Gate) durch die Default-/Fehlerpfad-Aenderungen unveraendert keyfrei auf claude-cli aufloest. Schuetzt das bereits korrekte Verhalten vor Regression. Erfolgskriterium 'Holdout-Gate bleibt keyfrei'.",
    "type": "test",
    "complexity": "low",
    "context_size": "S",
    "estimated_tokens": 1500,
    "status": "pending",
    "retry_count": 0,
    "llm_id": null,
    "container_id": null,
    "commit_hash": null,
    "dependencies": [
      "Factory: Builtin-Default completion auf claude-cli umstellen"
    ],
    "error_context": [],
    "con_ids": [],
    "parallel_group": null,
    "test_ids": [],
    "actual_tokens": null,
    "run_id": null,
    "test_file": null,
    "test_command": null,
    "test_framework": null
  },
  {
    "id": "2f779635-09f1-40fe-8efc-20ad07313133",
    "spec_id": "SPEC-0050",
    "title": "Doku: keyfreies Default-Routing in config.yaml-Vorlage/Provider-Doku",
    "description": "Das keyfreie Default-Verhalten (claude-cli als Default fuer completion, anthropic als Opt-in, kein stiller Fallback) in der config.yaml-Vorlage und der Provider-Dokumentation beschreiben. Schritt 5 der Implementierungsreihenfolge, keine eigene FR.",
    "type": "doc",
    "complexity": "low",
    "context_size": "S",
    "estimated_tokens": 1500,
    "status": "pending",
    "retry_count": 0,
    "llm_id": null,
    "container_id": null,
    "commit_hash": null,
    "dependencies": [
      "Factory: Builtin-Default completion auf claude-cli umstellen",
      "Factory: Fail-Loud bei nicht nutzbarem Provider ohne stillen Fallback"
    ],
    "error_context": [],
    "con_ids": [],
    "parallel_group": null,
    "test_ids": [],
    "actual_tokens": null,
    "run_id": null,
    "test_file": null,
    "test_command": null,
    "test_framework": null
  }
]