[
  {
    "id": "1495a430-2d6b-406a-9350-dbdf2b6da95a",
    "spec_id": "SPEC-0052",
    "title": "ConfigCheck base infrastructure",
    "description": "Erstellt tool/sdd_cli/config_validator.py mit ConfigIssue-Dataclass (level, path, message), ConfigCheck-ABC (run-Methode), ChainRunner (führt alle Checks sequenziell aus, sammelt Issues) und CompositeCheck (akkumuliert Pfad-Kontext beim Traversieren der Config-Hierarchie). Keine FR-spezifische Logik – nur Abstraktion.",
    "type": "code",
    "complexity": "medium",
    "context_size": "M",
    "estimated_tokens": 3500,
    "status": "pending",
    "retry_count": 0,
    "llm_id": null,
    "container_id": null,
    "commit_hash": null,
    "dependencies": [],
    "error_context": [],
    "con_ids": [],
    "parallel_group": null,
    "test_ids": [],
    "actual_tokens": null,
    "run_id": null,
    "test_file": "tests/unit/test_con0190_config_validation_rules.py",
    "test_command": "pytest tests/unit/test_con0190_config_validation_rules.py -k 'chain_runner or composite or config_issue' -x --tb=short",
    "test_framework": "pytest"
  },
  {
    "id": "f495545b-6bbf-44a4-8b99-b6df71fed1f1",
    "spec_id": "SPEC-0052",
    "title": "RequiredFieldsCheck",
    "description": "Implementiert RequiredFieldsCheck: prüft ob version, project.name und project.description in der Config gesetzt und nicht leer sind (FR-01). Meldet fehlende Felder mit vollem Punkt-Pfad und lesbarer Beschreibung als ConfigIssue(level='error').",
    "type": "code",
    "complexity": "low",
    "context_size": "S",
    "estimated_tokens": 1500,
    "status": "pending",
    "retry_count": 0,
    "llm_id": null,
    "container_id": null,
    "commit_hash": null,
    "dependencies": [
      "ConfigCheck base infrastructure"
    ],
    "error_context": [],
    "con_ids": [],
    "parallel_group": "checks",
    "test_ids": [],
    "actual_tokens": null,
    "run_id": null,
    "test_file": "tests/unit/test_con0190_config_validation_rules.py",
    "test_command": "pytest tests/unit/test_con0190_config_validation_rules.py -k 'required_fields' -x --tb=short",
    "test_framework": "pytest"
  },
  {
    "id": "36d52b0d-1065-4f07-bdf0-fdfc9a36cb25",
    "spec_id": "SPEC-0052",
    "title": "ProviderEnumCheck",
    "description": "Implementiert ProviderEnumCheck: iteriert über alle llm.<component>-Blöcke und prüft ob provider in ('anthropic', 'claude-cli', 'openai-compat', 'huggingface') liegt (FR-02). Bei ungültigem Wert: Error mit Feldpfad und Anzeige der erlaubten Menge.",
    "type": "code",
    "complexity": "low",
    "context_size": "S",
    "estimated_tokens": 1500,
    "status": "pending",
    "retry_count": 0,
    "llm_id": null,
    "container_id": null,
    "commit_hash": null,
    "dependencies": [
      "ConfigCheck base infrastructure"
    ],
    "error_context": [],
    "con_ids": [],
    "parallel_group": "checks",
    "test_ids": [],
    "actual_tokens": null,
    "run_id": null,
    "test_file": "tests/unit/test_con0190_config_validation_rules.py",
    "test_command": "pytest tests/unit/test_con0190_config_validation_rules.py -k 'provider_enum' -x --tb=short",
    "test_framework": "pytest"
  },
  {
    "id": "ff4269a1-fb0e-421f-ab9b-7b2f3a284322",
    "spec_id": "SPEC-0052",
    "title": "OpenAiCompatCheck",
    "description": "Implementiert OpenAiCompatCheck: wenn ein llm-Block provider=openai-compat hat, müssen base_url und model im selben Block gesetzt sein (FR-03). Nutzt CompositeCheck-Kontext für automatischen Pfad-Aufbau (z.B. 'llm.completion.base_url fehlt').",
    "type": "code",
    "complexity": "medium",
    "context_size": "S",
    "estimated_tokens": 2000,
    "status": "pending",
    "retry_count": 0,
    "llm_id": null,
    "container_id": null,
    "commit_hash": null,
    "dependencies": [
      "ConfigCheck base infrastructure"
    ],
    "error_context": [],
    "con_ids": [],
    "parallel_group": "checks",
    "test_ids": [],
    "actual_tokens": null,
    "run_id": null,
    "test_file": "tests/unit/test_con0190_config_validation_rules.py",
    "test_command": "pytest tests/unit/test_con0190_config_validation_rules.py -k 'openai_compat' -x --tb=short",
    "test_framework": "pytest"
  },
  {
    "id": "2ee725a9-6aba-4e10-98f7-9ecd48339f81",
    "spec_id": "SPEC-0052",
    "title": "HuggingFaceCheck",
    "description": "Implementiert HuggingFaceCheck: wenn provider=huggingface und hf_mode != 'local', muss hf_token gesetzt oder ${HF_TOKEN} als Env-Var auflösbar sein (FR-04). Fehlender Token → Error. Env-Var-Auflösung via os.environ.get.",
    "type": "code",
    "complexity": "medium",
    "context_size": "S",
    "estimated_tokens": 2000,
    "status": "pending",
    "retry_count": 0,
    "llm_id": null,
    "container_id": null,
    "commit_hash": null,
    "dependencies": [
      "ConfigCheck base infrastructure"
    ],
    "error_context": [],
    "con_ids": [],
    "parallel_group": "checks",
    "test_ids": [],
    "actual_tokens": null,
    "run_id": null,
    "test_file": "tests/unit/test_con0190_config_validation_rules.py",
    "test_command": "pytest tests/unit/test_con0190_config_validation_rules.py -k 'huggingface' -x --tb=short",
    "test_framework": "pytest"
  },
  {
    "id": "037c09df-02f9-48bf-8832-b5fac3a434f4",
    "spec_id": "SPEC-0052",
    "title": "AnthropicCheck",
    "description": "Implementiert AnthropicCheck: wenn provider=anthropic und weder api_key noch ${ANTHROPIC_API_KEY} auflösbar, wird ein ConfigIssue(level='warning') ausgegeben – kein Error, da keyfreier Betrieb via claude-cli erlaubt ist (FR-05).",
    "type": "code",
    "complexity": "low",
    "context_size": "S",
    "estimated_tokens": 1500,
    "status": "pending",
    "retry_count": 0,
    "llm_id": null,
    "container_id": null,
    "commit_hash": null,
    "dependencies": [
      "ConfigCheck base infrastructure"
    ],
    "error_context": [],
    "con_ids": [],
    "parallel_group": "checks",
    "test_ids": [],
    "actual_tokens": null,
    "run_id": null,
    "test_file": "tests/unit/test_con0190_config_validation_rules.py",
    "test_command": "pytest tests/unit/test_con0190_config_validation_rules.py -k 'anthropic' -x --tb=short",
    "test_framework": "pytest"
  },
  {
    "id": "eb569a09-952d-471d-a04a-48fba93d967e",
    "spec_id": "SPEC-0052",
    "title": "sdd config validate CLI command",
    "description": "Registriert Subcommand 'sdd config validate' in lifecycle.py/main.py. Lädt config.yaml, instantiiert ChainRunner mit allen Checks, gibt rich-formatierte Ausgabe (rot=Error, gelb=Warning, grün=OK) aus und setzt Exit-Code 1 bei mindestens einem Error-Issue, 0 bei valider Config (FR-06).",
    "type": "code",
    "complexity": "medium",
    "context_size": "M",
    "estimated_tokens": 3000,
    "status": "pending",
    "retry_count": 0,
    "llm_id": null,
    "container_id": null,
    "commit_hash": null,
    "dependencies": [
      "RequiredFieldsCheck",
      "ProviderEnumCheck",
      "OpenAiCompatCheck",
      "HuggingFaceCheck",
      "AnthropicCheck"
    ],
    "error_context": [],
    "con_ids": [],
    "parallel_group": null,
    "test_ids": [],
    "actual_tokens": null,
    "run_id": null,
    "test_file": "tests/contract/test_con0191_config_validate_cli.py",
    "test_command": "pytest tests/contract/test_con0191_config_validate_cli.py -k 'not json' -x --tb=short",
    "test_framework": "pytest"
  },
  {
    "id": "f0f76e22-8b05-4556-8ab1-604386ded03d",
    "spec_id": "SPEC-0052",
    "title": "JSON output flag for config validate",
    "description": "Ergänzt '--json'-Flag für 'sdd config validate': gibt statt rich-Ausgabe ein JSON-Array mit Objekten {level, path, message} auf stdout aus (FR-07). Exit-Code-Logik identisch zum Text-Modus. Kein rich-Import bei --json.",
    "type": "code",
    "complexity": "low",
    "context_size": "S",
    "estimated_tokens": 1500,
    "status": "pending",
    "retry_count": 0,
    "llm_id": null,
    "container_id": null,
    "commit_hash": null,
    "dependencies": [
      "sdd config validate CLI command"
    ],
    "error_context": [],
    "con_ids": [],
    "parallel_group": null,
    "test_ids": [],
    "actual_tokens": null,
    "run_id": null,
    "test_file": "tests/contract/test_con0191_config_validate_cli.py",
    "test_command": "pytest tests/contract/test_con0191_config_validate_cli.py -k 'json' -x --tb=short",
    "test_framework": "pytest"
  }
]