[
  {
    "id": "a1b2c3d4-0001-4000-8000-000000000001",
    "spec_id": "SPEC-0041",
    "title": "FrCoverageSpecification + FrCoverageChecker implementieren",
    "description": "FR-01, FR-02: FrCoverageSpecification extrahiert FR-IDs aus Spec-Text und prüft Task-Mapping. FrCoverageChecker wraps die Specification als ComplianceChecker.",
    "type": "code",
    "complexity": "medium",
    "context_size": "M",
    "estimated_tokens": 3000,
    "status": "committed",
    "retry_count": 0,
    "llm_id": null,
    "container_id": null,
    "commit_hash": null,
    "dependencies": [],
    "error_context": [],
    "con_ids": ["CON-0152"],
    "parallel_group": "group-1",
    "test_ids": ["TST-0178"],
    "actual_tokens": null,
    "run_id": null
  },
  {
    "id": "a1b2c3d4-0002-4000-8000-000000000002",
    "spec_id": "SPEC-0041",
    "title": "TypeAwareTestChecker implementieren",
    "description": "FR-03: TypeAwareTestChecker prüft ob Specs mit Tag webui/frontend/api mindestens einen Integration/Contract-Test haben.",
    "type": "code",
    "complexity": "medium",
    "context_size": "M",
    "estimated_tokens": 2500,
    "status": "committed",
    "retry_count": 0,
    "llm_id": null,
    "container_id": null,
    "commit_hash": null,
    "dependencies": [],
    "error_context": [],
    "con_ids": ["CON-0154"],
    "parallel_group": "group-1",
    "test_ids": ["TST-0179"],
    "actual_tokens": null,
    "run_id": null
  },
  {
    "id": "a1b2c3d4-0003-4000-8000-000000000003",
    "spec_id": "SPEC-0041",
    "title": "RouteRegistrationChecker implementieren",
    "description": "FR-04: RouteRegistrationChecker prüft für api-getaggte Specs ob ihre Routen in main.py via include_router registriert sind.",
    "type": "code",
    "complexity": "medium",
    "context_size": "M",
    "estimated_tokens": 2500,
    "status": "committed",
    "retry_count": 0,
    "llm_id": null,
    "container_id": null,
    "commit_hash": null,
    "dependencies": [],
    "error_context": [],
    "con_ids": ["CON-0154"],
    "parallel_group": "group-1",
    "test_ids": ["TST-0179"],
    "actual_tokens": null,
    "run_id": null
  },
  {
    "id": "a1b2c3d4-0004-4000-8000-000000000004",
    "spec_id": "SPEC-0041",
    "title": "Enforcement in spec_approve",
    "description": "FR-05: sdd spec approve ruft die vollständige ComplianceChecker-Kette auf; bei uncovered FRs Exit 2.",
    "type": "code",
    "complexity": "low",
    "context_size": "S",
    "estimated_tokens": 1500,
    "status": "committed",
    "retry_count": 0,
    "llm_id": null,
    "container_id": null,
    "commit_hash": null,
    "dependencies": ["a1b2c3d4-0001-4000-8000-000000000001"],
    "error_context": [],
    "con_ids": ["CON-0153"],
    "parallel_group": "group-2",
    "test_ids": ["TST-0181"],
    "actual_tokens": null,
    "run_id": null
  },
  {
    "id": "a1b2c3d4-0005-4000-8000-000000000005",
    "spec_id": "SPEC-0041",
    "title": "Enforcement in sdd finalize",
    "description": "FR-06: SpecFinalizer.run() ruft die ComplianceChecker-Kette auf vor _mark_implemented(); bei Fehler kein Status-Wechsel.",
    "type": "code",
    "complexity": "low",
    "context_size": "S",
    "estimated_tokens": 1500,
    "status": "committed",
    "retry_count": 0,
    "llm_id": null,
    "container_id": null,
    "commit_hash": null,
    "dependencies": ["a1b2c3d4-0001-4000-8000-000000000001"],
    "error_context": [],
    "con_ids": ["CON-0153"],
    "parallel_group": "group-2",
    "test_ids": ["TST-0180"],
    "actual_tokens": null,
    "run_id": null
  },
  {
    "id": "a1b2c3d4-0006-4000-8000-000000000006",
    "spec_id": "SPEC-0041",
    "title": "Enforcement in sdd validate",
    "description": "FR-07: validate.py ergänzt FR-Coverage-Check für approved/in-progress Specs; Fehler werden im Report gemeldet.",
    "type": "code",
    "complexity": "low",
    "context_size": "S",
    "estimated_tokens": 1500,
    "status": "committed",
    "retry_count": 0,
    "llm_id": null,
    "container_id": null,
    "commit_hash": null,
    "dependencies": ["a1b2c3d4-0001-4000-8000-000000000001"],
    "error_context": [],
    "con_ids": ["CON-0153"],
    "parallel_group": "group-2",
    "test_ids": ["TST-0180"],
    "actual_tokens": null,
    "run_id": null
  },
  {
    "id": "a1b2c3d4-0007-4000-8000-000000000007",
    "spec_id": "SPEC-0041",
    "title": "Pre-Commit-Hook implementieren",
    "description": "FR-08: sdd install-hooks installiert einen blocking pre-commit Hook; bei Staged-Änderungen an main.py/routes/App.tsx werden Spec-Tests ausgeführt.",
    "type": "code",
    "complexity": "medium",
    "context_size": "M",
    "estimated_tokens": 3000,
    "status": "committed",
    "retry_count": 0,
    "llm_id": null,
    "container_id": null,
    "commit_hash": null,
    "dependencies": [],
    "error_context": [],
    "con_ids": ["CON-0155"],
    "parallel_group": "group-1",
    "test_ids": ["TST-0182"],
    "actual_tokens": null,
    "run_id": null
  },
  {
    "id": "a1b2c3d4-0008-4000-8000-000000000008",
    "spec_id": "SPEC-0041",
    "title": "Konfigurationsschema compliance: implementieren",
    "description": "FR-09: Alle Checks sind über compliance: in config.yaml konfigurierbar; ungültige Werte verwenden Default und erzeugen eine Warnung.",
    "type": "code",
    "complexity": "low",
    "context_size": "S",
    "estimated_tokens": 1000,
    "status": "committed",
    "retry_count": 0,
    "llm_id": null,
    "container_id": null,
    "commit_hash": null,
    "dependencies": [],
    "error_context": [],
    "con_ids": ["CON-0156"],
    "parallel_group": "group-1",
    "test_ids": ["TST-0178"],
    "actual_tokens": null,
    "run_id": null
  }
]
